{
  "schema_version": "1.0.0",
  "version": "0.2.0",
  "lifecycle": "draft",
  "authority": {
    "origin": "independent_proposal",
    "normative_class": "operational_proposal",
    "institutional_approval": "none",
    "applicability_note": "独立の運用試案。具体的な権限、適用法令、契約及び組織規程は案件ごとに確認する。"
  },
  "access": {
    "classification": "public",
    "may_share_with_external_ai": true
  },
  "sources": [],
  "links": [],
  "id": "TSK-REV-PRIVACY",
  "title": {
    "ja": "個人情報・機密・公開範囲の確認"
  },
  "responsible_role": "情報保護確認担当者",
  "stage_ids": [
    "06"
  ],
  "inputs": [
    "審査対象資料（固定版・ファイルハッシュ）",
    "適用する根拠台帳・素材台帳・確認記録",
    "権限及び公開条件に関する関係記録"
  ],
  "outputs": [
    "個人情報・機密・公開範囲の確認に関する確認記録",
    "未解決事項、差戻し条件及び責任者一覧"
  ],
  "requires_human_decision": true,
  "acceptance_criteria": [
    "対象文書の版・ハッシュ・対象媒体・確認者を記録した",
    "担当範囲内の審査結果、証拠、対象外及び未解決事項を識別した",
    "判断保留・差戻し・条件付き判断について責任者と再審査条件を記載した"
  ],
  "review_roles": [
    "関係する専門確認者",
    "審査責任者"
  ],
  "procedure_ref": {
    "kind": "procedure_definition",
    "id": "PRC-REV-PRIVACY",
    "version": "0.1.0"
  },
  "document_template_refs": [
    {
      "kind": "document_template",
      "id": "TPL-DOC-076",
      "version": "0.2.0"
    }
  ],
  "checklist_refs": [
    {
      "kind": "checklist_definition",
      "id": "TPL-CHK-035",
      "version": "0.2.0"
    }
  ],
  "standard_refs": [
    {
      "kind": "knowledge_entry",
      "id": "KNW-REV-PRIVACY",
      "version": "0.1.0"
    }
  ],
  "ethics_refs": [
    {
      "kind": "knowledge_entry",
      "id": "KNW-ETH-REV-PERSON",
      "version": "0.1.0"
    },
    {
      "kind": "knowledge_entry",
      "id": "KNW-ETH-REV-AI",
      "version": "0.1.0"
    }
  ]
}
