{
  "schema_version": "1.0.0",
  "id": "TSK-REV-AUTH",
  "version": "0.2.0",
  "title": {
    "ja": "責任ある公開可否の判断と版の承認"
  },
  "lifecycle": "draft",
  "responsible_role": "権限ある公開決裁者",
  "authority": {
    "origin": "independent_proposal",
    "normative_class": "operational_proposal",
    "institutional_approval": "none",
    "applicability_note": "独立の業務設計試案。法令、契約、内部権限規程等の適用と現行版は個別に検討する。実在の承認を意味しない。"
  },
  "access": {
    "classification": "public",
    "may_share_with_external_ai": true
  },
  "sources": [],
  "links": [],
  "stage_ids": [
    "06"
  ],
  "inputs": [
    "審査対象資料（固定版・ファイルハッシュ）",
    "適用する根拠台帳・素材台帳・確認記録",
    "権限及び公開条件に関する関係記録"
  ],
  "outputs": [
    "責任ある公開可否の判断と版の承認に関する確認記録",
    "未解決事項、差戻し条件及び責任者一覧"
  ],
  "requires_human_decision": true,
  "acceptance_criteria": [
    "対象文書の版・ハッシュ・対象媒体・確認者を記録した",
    "担当範囲内の審査結果、証拠、対象外及び未解決事項を識別した",
    "判断保留・差戻し・条件付き判断について責任者と再審査条件を記載した"
  ],
  "review_roles": [
    "権限の根拠を確認した決裁責任者"
  ],
  "procedure_ref": {
    "kind": "procedure_definition",
    "id": "PRC-REV-AUTH",
    "version": "0.1.0"
  },
  "document_template_refs": [
    {
      "kind": "document_template",
      "id": "TPL-DOC-073",
      "version": "0.2.0"
    }
  ],
  "checklist_refs": [
    {
      "kind": "checklist_definition",
      "id": "TPL-CHK-035",
      "version": "0.2.0"
    }
  ],
  "standard_refs": [
    {
      "kind": "knowledge_entry",
      "id": "KNW-REV-DECISION",
      "version": "0.1.0"
    },
    {
      "kind": "knowledge_entry",
      "id": "KNW-REV-SCOPE",
      "version": "0.1.0"
    }
  ],
  "ethics_refs": [
    {
      "kind": "knowledge_entry",
      "id": "KNW-ETH-REV-INDEPENDENCE",
      "version": "0.1.0"
    }
  ]
}
